"","candidate","combo","gender","trimmed","inc","openseat","ss_party"
"262","Anderson, Jeramey","Jeramey Anderson MS",0,"Jeramey believes that a woman has the right to choose, he also believes that women should have easy access to contraception.  Jeramey promises to stand firm and continue to fight against any legislation or executive action that would directly or indirectly discriminate against women.\n?\nJeramey will stand with planned parenthood and continue to support the necessary preventive and reproductive health care services like cancer screenings, STD testing and low-cost birth control to millions of American women.",0,0,0
"263","Bush, Cori","Cori Bush MO",1,"Cori supports a woman's right to choose and will work to ensure the continued access to healthcare for women and girls. \n\nCori will continue to fight against the discrimination of women in the workplace, working to close the gender and racial pay gaps.",0,0,1
"264","Messmer, John","John Messmer MO",0,"Summary:\n* Women have had a fundamental right to abortions since the 1973 Roe v. Wade decision. This cannot be a right that is ignored or negated in the future. It must be protected by the courts and by Congress.\n* We can agree that abortion should be rare. And Congress can take a role by doing more to reduce unwanted pregnancies. That begins with the encouragement of real sex-education curricula in our schools. It also must include sensible fact-based education regarding contraceptives and birth-control.\n* The federal government needs to do significantly more for pregnant women. This includes making pre-natal and neo-natal care more affordable and accessible. Congress should also do more to remove the unnecessary bureaucratic barriers to adoption.\n\n \nI am pro-choice.\nAmerican women have had a constitutional right to abortion since 1973. This is now a fundamental right that is fully protected by the American judicial system. Such fundamental rights in a civil society cannot simply be negated. And they should not be so cavalierly reversed. Since Roe v. Wade, an entire generation of women have lived with this liberty.\nAnti-choice legislators sometimes fail to appreciate this fact. They abhor abortion to such a degree that they often refuse to appreciate the consequences that laws that restrict reproductive rights have on society – particularly on American women. Reversing this established right would be cruel and counterproductive. That is why we need more legislators that will fight for reproductive rights.\nBut there are as many important similarities between opposing sides in this debate as there are differences. We can agree that abortion should be rare. And we can agree that there is a role that government can play in reducing the number of unwanted pregnancies. And I would hope that we can all agree that among the things that government can do, making criminals of women and their doctors should not be an option.\nWhen it comes to this issue, too many Americans live in a world that no longer exists. Victorian and puritan morals belong in museum displays, not in the decision-making of elected representatives. If we want to lower the prevalence of abortion, we need a strategy that fits today’s realities. Here is a start:\n• Congress needs to encourage REAL sex education curricula in our nation’s schools. Young people will have sex when they’re ready. No lecture from mom or dad or a teacher will stop that. It’s absurd to accept that fact but then NOT educate adolescents with the facts – both biological and psychological – that they need. And the curriculum needs to be grounded in reality – not in a Norman Rockwell version of reality that treats sex as something dirty and sex education as taboo.\n• Adolescents need to learn from this curriculum that they are not abnormal if they choose to abstain from sex. At the same time, however, we need to face the reality that if adolescents do engage in sex that they understand everything they need to know with respect to birth control. Along with fact-based education efforts on birth control should come convenient access to contraceptives. In countries where this combination exists, unwanted teen pregnancies are rare. Allowing old-fashioned prejudices about sex and birth control to dominate this debate is ridiculous and a gross disservice to our children.\n• Congress should compel the states and the Department of Health and Human Services to do more for pregnant women. If women seek abortions because they are unsure of their ability to care for their children, a civil society would want to naturally do more to make carrying a baby to term a more appealing option. Government at all levels can do more to make pre-natal and neo-natal care more affordable and accessible. In addition, more should be done to remove the unnecessary bureaucratic barriers to adoption.",0,0,2
"265","Osmack, Mark","Mark Osmack MO",0,"Mark trusts women and believes abortion should be safe and legal. Birth control should be freely accessible to all Missouri women regardless of where they work or where they live. By including comprehensive sex education in our schools and access to reproductive care and contraception in our healthcare system, we can dramatically reduce the number of unwanted pregnancies.\nEquality must include equal access to contraception, equal access to reproductive healthcare, and equal choice over when, how, and if someone chooses to start a family.",0,0,2
"266","VanOstran, Cort","Cort Vanostran MO",0,NA,0,0,2
"267","Haas, Bill","Bill Haas MO",0,NA,0,0,2
"268","Hazel, Robert","Robert Hazel MO",0,"“The Equal Pay Act of 1963, aimed at abolishing wage disparity based on sex….” has been the Law of the Land for some 55 years.  Even so, even now after all this time, such disparity exists, and we all know it; indeed, all too often women are paid less than men for the same jobs throughout the land.  Such injustice cannot be countenanced, excused or ignored.  This must change.   Gentlemen, what are we afraid of?",0,0,2
"269","Geppert, Katy","Katy Geppert MO",1,"Decisions about one’s health should be made by you and your doctor, not corporate executives or politicians. As such, I fully support a woman’s right to determine what is best for her and her body. That is why I will work to require that any medical organizations who wish to receive federal funds must provide patients with medically accurate and unbiased information concerning pregnancy-related service options.\n\nI will never compromise on women’s health.\n\nEvery woman has a right to forge her own path to motherhood and for many of us it is not always a straight path. While I do want to see the number of abortions in this country go down, I also want every child to be born to parents who can love and provide for them. That is why I think it is important to help set up women and families for success by working to ensure access to affordable birth control, access to necessary pre-natal care, and mandatory paid family leave for both parents.",0,0,0
"270","Thompson, Hallie","Hallie Thompson MO",1,NA,0,0,0
"271","Hoagenson, Renee","Renee Hoagenson MO",1,NA,0,0,0
"272","Apple, Winston","Winston Apple MO",0,"I am anti-abortion, but ultimately, pro-choice.  I believe that we should do everything we can to minimize the number of abortions.  However, when a woman is faced with an unwanted pregnancy, the decision regarding whether or not to have an abortion is her decision.  She should not be denied the freedom to make her own decision by the government.\nAlthough abstinence is the only 100% effective means of avoiding unplanned pregnancies, relying on teens to abstain from sex is not a realistic plan.  The most basic means of preventing unplanned and unwanted pregnancies is to provide ready access to sex education and contraception for people of all ages, especially young adults.",0,0,0
"273","Martin, Henry","Henry Martin MO",0,"Respecting The Right To Choose\nFamily planning is a key to combatting poverty. Every American has a journey that forces decisions daily\nand each individual should be allowed to make the decision that is best for themselves and their family.\nThe matter of abortion is contentious and will apparently be perpetually debated in the political arena,\nto that end, it is my position that no matter what the choice made by that family, it was a difficult one\nand the one they deem best. I stand by the individual right to choose because I believe people can make\nthe best choices for themselves and their long term success.",0,0,0
"274","Schoolcraft, Jamie","Jamie Schoolcraft MO",0,"As in all healthcare, education is paramount in providing the best care and that is no different when it comes to Women’s health. I firmly believe that with more education and by providing better healthcare, the need to terminate a pregnancy will diminish significantly. A Physician Assistant's oath is to save and protect life when we can, but a part of that oath is educating the patient about their healthcare options, utilizing safe practices, and permitting a woman the right to choose how her body is treated. I am pro-choice. Being pro-choice is about healthcare. It is about education. It is about helping women carry out their choices and the full range of options available to them.",0,0,0
"275","Ellis, Kathy","Kathy Ellis MO",1,"Healthcare is a right.  Every person in this country deserves to have good healthcare, not just the wealthy few.  I support a single payer medical system to expand “medicare” for all.\nThe present course of action that the White House and Congress are taking sends us backwards.  We don’t want to go back to the way thing used to be:\n* Being denied coverage for pre-existing conditions,\n* Medical bills threatening to bankrupt families,\n* Practitioners fighting insurance companies for basic coverage for their patients, and\n* Disparity between what men and women pay for health insurance.\nThe problems with American healthcare are caused by predatory insurance companies and monopolies, not the Affordable Care Act.\nWe need to expand the Affordable Care Act by passing legislation that corrects what is not working in the ACA and allows greater access to everyone. We need access to affordable prescription medication as well as access to birth control. I am pro-choice and support a woman’s privacy and reproductive rights.",0,0,0
"276","Williams, Kathleen","Kathleen Williams MT",1,"Kathleen supports equal pay for equal work. In Montana, a woman makes 73 cents on the dollar for the same work as a man, the fourth worst ratio in the nation. This problem is particularly acute in farming, fishing, and forestry -- industries that are crucial to the economic fabric of Montana and ones that are close to Kathleen’s heart as a sportswoman and conservationist.The foundation for federally mandated equal pay exists, but it must be improved upon. While the Equal Pay Act of 1963 lays out the principle that people must be paid the same amount for the same work, federal courts have interpreted “equal work” so narrowly that an equal pay case can only be won if a man and woman have almost the exact same job. This is a situation where Congress must step in and modify the statute to clarify and make the requirements workable.Equal pay challenges will not be successful as long as women fear retaliation for coming forward. Congress should protect women who demand equal pay from retribution by their employers.Ultimately, equal pay is both a basic fairness issue and a family issue. Single mothers and women who are the primary earners in a household suffer most when they are treated unfairly, especially in part-time or minimum wage jobs. Kathleen strongly supports a living wage which will lift up hard working women and ensure that they can provide for their families.Kathleen will fervently fight for these issues because she has experienced the injustice of inequality that women face.",0,0,2
"277","Kier, Grant","Grant Kier MT",0,"Every person deserves a level playing field in the workplace and the certainty that a hard day of work will be rewarded fairly. The fact that women in Montana still only get paid 70% of what men are paid in the same position is unacceptable. Montana is also facing a looming workforce shortage, with businesses struggling to find qualified employees. When qualified and capable people know they will be fairly compensated for their effort, they will be more likely to enter the workforce, strengthening the economic foundation of our communities.\nIn addition to promoting laws that support equal pay, empowering workers in traditionally female and low-wage careers, such as caregiving and service, to negotiate for fair wages and benefits helps workers regardless of whether they are men or women. Grant supports legislation that increases transparency on wages in the workforce and that allows collective bargaining, which are both critical steps toward equal pay for equal work.\n",0,0,2
"278","Heenan, John","John Heenan MT",0,"Hypocritically, the politicians who talk the most about small government are the ones most eager to allow the government to invade our bedrooms and doctor’s offices. John adamantly supports the rights of women to make their own healthcare decisions without government interference. He will steadfastly oppose all efforts to defund Planned Parenthood.",0,0,2
"279","Meyer, John","John Meyer MT",0,NA,0,0,2
"280","Meyer, John","John Meyer MT",0,NA,0,0,2
"281","Crawford, Dennis","Dennis Crawford NE",0,NA,0,0,0
"282","McClure, Jessica","Jessica McClure NE",1,NA,0,0,0
"283","Eastman, Kara","Kara Eastman NE",1,"I support the right to privacy and women’s right to reproductive health. Women are capable of making their own decisions without interference from politicians who use this issue as a political playing card. The decision to have an abortion should be left to the woman, her family, her doctor and her faith. And, if a woman chooses to exercise her reproductive freedom by having an abortion, she should not be shamed or condemned.\nIf we truly desire to prevent unwanted pregnancies, we should invest in healthcare, education and job creation. We should provide access to birth control and age-appropriate sex education. We should also be able to have these difficult conversations and acknowledge that the issues are not black and white.",0,0,2
"284","Theobald, Paul","Paul Theobald NE",0,NA,0,0,0
"285","Dysilva, Reuben","Reuben D'Silva NV",0,"Support laws for equal pay for women, paid leave (especially emergency, family, maternity, and medical).\n* Provide access to affordable child care",0,0,1
"286","Shepherd, Rick","Rick Shepherd NV",0,"It is unacceptable to deny a woman her right to choose what to do with her body.  It is maddening that insurance companies universally support medications to provide aid for erectile dysfunction but can refuse contraception options.  We are all created equal regardless of whether we carry our sex organs internally or externally.\nPay equity for all people is another concern that should have been resolved long ago.  It is frustrating that “We the People” has to be further specified to be actually inclusive.  Discrimination of any kind is unacceptable.\nDomestic abuse is predominately perpetrated against women.  In November we Nevadans will have the opportunity to vote on sensible legislation to curb gun violence which has already been adopted by 18 States and found to profoundly reduce violence of many kinds including domestic abuse, murder and suicide.\nImproving access to childcare will allow women who want to work the freedom to do so.  Improving wages will allow these same women the freedom to have one decent-paying job instead of two or three that pay poorly with erratic hours.  This empowers women who are Mothers to be able to spend more time with their children.  This improves the quality of life for all involved.\nMy family has been involved with the Soroptimists group for years to help women and children work through some of the most troubling times anyone can imagine.  I highly encourage you to become involved too.",0,0,2
"287","Fogarty, Patrick","Patrick Fogarty NV",0,NA,0,0,2
"288","Alm, Vance","Vance Alm NV",0,NA,0,0,2
"289","Koble, Clint","Clint Koble NV",0,"I support Roe v Wade; it is the law and I want it to remain in place.  I respect a woman’s right to choose.",0,0,2
"290","Love, Jack","Jack Love NV",0,"Let's stand together to vigorously defend women’s reproductive rights and access to family planning. We must consolidate the gains of the LGBTQIA community whose rights are threatened by the current administration. I vow to close the gender pay gap and have zero tolerance for sexual harassment.",0,1,2
"291","Lee, Susie","Susie Lee NV",1,"The Equal Pay Act was passed 52 years ago, yet women still earn only $.78 for each dollar that a man earns for an identical job. That pay gap is even larger for women of color. This is unacceptable, and I will fight every day for pay equity. When women thrive, families thrive.\nMoreover, it is long past time that we address the pervasive issue of sexual misconduct and harassment. As we’ve seen, there are not sufficient safeguards in place for women in the workplace. Additionally, we need to fight for fair representation for women in leadership roles in all industries, so that we can truly change the culture of harassment that has gone unchallenged for far too long.\nThe gender pay gap and workplace harassment aren’t the only issue harming American women’s economic opportunities. Anti-choice ideologues in Washington are fighting to defund Planned Parenthood and write laws that limit women’s reproductive health decisions. I’ll stand up for a woman’s right to choose. I’ll also fight for paid family leave, contraceptive access, and fair workplace protections for the young women throughout this country who are just beginning to pursue their dreams.",0,1,2
"292","Weiss, Michael","Michael Weiss NV",0,NA,0,1,2
"293","Pinjuv, Guy","Guy Pinjuv NV",0,"WE CAN DO BETTER. WE MUST DO BETTER.\nWe all deserve an America that respects women and men.\nThroughout American History, women have been systematically denied equal rights in public and private life. As a supporter of gender equality, I can’t understand why we would try to regulate women’s reproduction or refuse to offer equal pay as men. Our society has not considered regulating a man’s reproductive rights. As a matter of fact, most insurance policies will pay for Viagra, yet I have never seen people marching in the streets to limit vasectomies.\n\nWhy are we so focused on controlling a woman's right to make decisions about their own health and well-being? I believe women should decide reproductive health choices without government interference. This is an equality issue as is equal pay for equal work. We should protect women from violence and sexual harassment, and as a society, we should learn to raise children that respect women, and punish those that don’t….in the workplace, in public office, and in domestic violence situations.",0,1,2
"294","Schiffman, Steven","Steve Schiffman NV",0,"Steve steadfastly opposes Tea-party Republican efforts weaken women's rights by attacking organizations such as Planned Parenthood, which provide vital health services to millions of Americans of all genders, races, and ages.",0,1,2
"295","Vilela, Amy","Amy Vilela NV",1,"Repeal the Hyde Amendment. It’s time to repeal the Hyde Amendment and afford comprehensive reproductive services to all women, regardless of ability to pay.\n      Reproductive Justice. I will support Equal Access to Abortion Coverage in Health Insurance (EACH Woman Act) which prohibits political interference with private health insurance companies’ decisions to cover terminating a pregnancy.

The #metoo movement has helped our society progress on the issue of violence against women, but we are still not doing enough. In the United States, an American is sexually assaulted every 98 seconds, 1 out of every 6 American women are the victims of attempted or completed rape in her lifetime, and 9 out of every 10 victims of rape are female. Transgender people and Native Americans are also more susceptible to sexual violence in their lifetimes. Victims of sexual violence are highly prone to PTSD and depression, with over 70% experiencing moderate to severe distress, more than any other violent crime. \n    These figures are disgusting, unacceptable, and it would be morally incomprehensible if Congress continues to standby and do nothing to reverse these trends. We have a duty to protect Americans from heinous crimes like sexual assault, and so it is up to us to build upon the legacy of the Violence Against Women Act.\n    End the backlog of rape kits. I will vehemently fight to eliminate the backlog of hundreds of thousands of rape kits in the United States and make sure that law enforcement is better trained to handle sexual assault cases and evidence.\n      Increase U Visas. I will support any measure to increase the amount of U Visas available each year so that more immigrant women will be empowered to stand up to their assaulter. I will also support government initiatives to expand research of sexual assault within minority and immigrant communities, which have been largely underreported and ignored.\n      Raise statute of limitations. I will work to raise the statute of limitations in all states regarding sexual assault, so victims have enough time to process their grief and report their assault to law enforcement on their own time. \n      Support an independent federal council. An independent federal council to investigate allegations of negligence in handling of sexual assault claims by private corporations is needed to ensure the safety and respect of women in the private sector.\n      Me Too. Once in Congress, I will be a staunch supporter of and vote for the ME TOO Act.",0,1,2
"296","Anzalone, John","John Anzalone NV",0,"Equal rights for all is an issue that is very personal to me. Having two beautiful daughters has inspired me to fight for women's rights, but also fair and equal treatment of all Americans. If elected, I will:be vocal against racial and religious profiling\n  Protect and stand up for the Right to Life\n  support and defend the Equality Act of 2017 that amends the Civil Rights Act of 1964 to include sex, sexual orientation, and gender identity among the prohibited categories of discrimination or segregation in places of public accommodation\n  stand up against racial profiling by law enforcement\n  Fight for Federal guidelines that protect unarmed victims \n  support bills that fight for equal pay & employment

As a father of three, I believe in the strength of a family. Children are the most precious resource on this planet, and the joy they bring to all of us is priceless. As a man who has adopted two children and has witnessed the heartache of infertility, I appreciate the gift of a child; but deciding how a woman approaches a pregnancy is not my choice to make. If elected, I will:support Roe v Wade, but work for safe access to abortion\n  invest in Stem Cell research\n  protect a woman's right to privacy and equality\n  protect a woman's constitutional right to choose",0,1,2
"297","Spearman, Patricia","Pat Spearman NV",1,"Spearman said she believes in a woman’s right to choose abortion.\n“It is between a woman and her God,” she said. “I mean that is a very private matter. In many cases it is a very painful decision. As a pastor, I have listened to women who have debated and wrestled with whether or not to have an abortion. … Other people have nothing whatsoever to do with it. Nothing. And if you really are about life it has to be about life outside the womb.”

Spearman led the charge to ratify the Equal Rights Amendment in the U.S. Constitution. The proposal passed the Legislature.\n“Here are the things I want to do in Congress. You’ve got to have equality. In every aspect of the human existence,” she said. “That means the ERA, once it is ratified in the states, Congress must vote to extend the deadline. Pay equity. It is not just about a difference in pay for men and women. It is really about economic security, now and in retirement. We have to have equality, period. Because you should not be denied equal rights because of who you are, who you love or where you live. That shouldn’t happen. We are all God’s children.\nWorker Protections\nSpearman was a co-sponsor of a bill that would have required certain employers to offer paid sick leave to their workers. Gov. Sandoval vetoed the measure, and lawmakers did not overturn it.\nShe sponsored a bill that would give businesses a tax credit if they assist their employees with the costs of child care. It was unsuccessful in the Democratic-controlled 2017 Legislature.",0,1,2
"298","Stephens, Allison","Allison Stephens NV",1,NA,0,1,2
"299","Pappas, Chris","Chris Pappas NH",0,"Chris ran for Executive Council after five Republican men voted to defund Planned Parenthood. After his election to the Executive Council in 2012, he led the successful fight to reverse that decision and fund family planning services and cancer screenings for more than 13,000 women and men in New Hampshire.As a member of the New Hampshire House, Chris earned a 100% pro-choice voting record and opposed legislation that would have interfered with a woman’s fundamental right to control her own body. In Congress, Chris will: Oppose attempts to restrict women’s access to reproductive health servicesSupport efforts to prevent businesses from being able to deny women access to contraception coverage in their health plansSupport the repeal of the Global Gag Rule so that organizations can provide family planning services to women around the world",0,1,2
