"","candidate","combo","gender","trimmed","inc","openseat","ss_party"
"177","Lombard, Laura","Laura Lombard KS",1,"EMBRACING OUR DIVERSITY\nFighting to Sustain & Increase Equal Rights:\nAs your U.S. Representative, I would fight for equal rights and opportunities for all Kansans and Americans, regardless of race, ethnicity, age, physical or mental disabilities, economic status, religion, creed, gender, national origin, veteran or military status, sexual orientation, or gender identity.\n\nAdvocating for Human Rights:\nNo one, whether man, woman, or child, should be subjected to physical, emotional, or sexual abuse. No one should be blamed for the unwanted advances of an aggressor for any reason. We should protect our citizens from harm and put responsibility on the perpetrator harming another individual rather than on the victim. \n\nAs your U.S. Representative, I would be a strong voice on issues of abuse and personal safety.\n\nAs a professional, I know all too well the challenges that men and women face in balancing professional and family life. \n\nAs your U.S. Representative, I would advocate for equal pay, paid maternity AND paternity leave, and affordable childcare. Having these protections in place are not only for the wellbeing of women but also for the well-being of families and society as a whole.\n\ Understanding Women’s Rights Are Human Rights:\nWe have made great progress in expanding the rights and opportunities for women in this country. However, we also have far to go in ensuring that all women have equal opportunities and treatment under the law. Many women still face barriers to entering and advancing in the workforce. In addition, women’s rights to make their own health decision is particularly under fire from this new Administration.\n\nA woman’s personal health decisions should be made in consultation with her family, her faith, and her doctor. I am pro-choice. I would like to emphasize the word “choice.” No one wants to make the decision to have an abortion. The decision to have an abortion is a very personal, very painful one. Particularly in situations where a woman’s life is at risk and a medical decision has to be made, that needs to be a determination between the doctor and patient. \n\nAs your U.S. Representative, I would defend a woman’s right to choose how best to handle her own family planning and healthcare. \n\nI am pro-birth control. Access to birth control methods and sex education has greatly reduced the number of accidental pregnancies and abortions per year. The best way to reduce the number of abortions is to educate people on the tools available to prevent unwanted pregnancies in the first place. For some, abstinence is the preferred method of birth control. For others, having access to other birth control methods is equally important.",0,0,0
"178","Pennington, Alonzo","Alonzo Pennington KY",0,"I will fight to make sure that working class people like us, are compensated a fair wage for their trade.  I will fight against all discrimination and ensuring equal pay for women in the workplace.",0,0,0
"179","Walker, Paul","Paul Walker KY",0,"I believe women have the right to make their own healthcare decisions. I also am committed to equal pay and equal rights for women and all groups because we are all human and on that basis alone deserve respect.",0,0,0
"180","Linderman, Hank","Hank Linderman KY",0,NA,0,0,0
"181","Sessions, Rane Olivia","Rane Sessions KY",1,"I believe in equal pay for equal work. I believe in family planning. I support anti-discrimination laws  such as those that unfairly punish pregnant women in the workplace. I support affordable healthcare so that women will be able to receive preventative medical care for annual mammograms and pap smears, as well as access to birth control.\n\nI support paternity and maternity leave. I believe in family planning. Young people should be taught about birth control, safe sex, and ideally we cut down on teens having children who are not prepared to raise a child.\n\nOnce that child is born, then we help so that the child’s basic needs are being met. I think it’s wrong to be pro-life and forget about the child once it has been born. That isn't pro-life, that is pro-birth.\n\nI believe that women need affordable access to birth control. I have been a single mom living in poverty. I went to Planned Parenthood for my medical care when I didn't have health insurance. I wasn’t able to overcome my poverty as a single mother until I remarried.\n\nMost young women who find themselves pregnant and raising their child are living in poverty. Many young women who become pregnant are not able to afford to get an education and find a way out of poverty for themselves and their child.\n\nI support Planned Parenthood, because they support healthcare for women and men.

I am Pro Choice. I know what it's like to be a young single mom trying to support myself and my child. I was able to overcome that once I re-married. I don't want a life of poverty for any child or any mother or father. I do not believe that any girl or woman who is raped or a victim of incest should be forced to carry a pregnancy to full term.\n\nI support family planning and I support education for young girls and women to avoid unplanned pregnancies. This is how we avoid abortions -- access to birth control and sex education for our young people so we avoid unwanted pregnancies.\n\nWe have one of the highest known rates of teen pregnancy and births in developed countries. Young people in the Netherlands, who have the second lowest teen pregnancy rate, have access to sex education and contraception.\n\nWe also have great differences in poverty and wealth in our country. There are much higher rates of teen pregnancy in disadvantaged youth. These are the underlying issues that create unplanned and unwanted pregnancies.\n\nI want to talk about late-term abortions, because most people don't realize what these actually are. These are devastating procedures to end a pregnancy when a baby is not yet able to live outside of the womb. The decision to abort is a medical decision based upon testing that show the baby will be born with life-threatening illnesses or serious physical defects that will result in a short and brutal life of pain and suffering for that baby.\n\nAnother medical reason for a late-term abortion is the mother's deteriorating health during the pregnancy and the high risk of death of the mother should she continue the pregnancy. These decisions are traumatic and not at all what the mother and parents want to have to make. Late-term abortions are tragic, rare, and they are difficult decisions for the mother, the father, and the physician.\n\nNo legislator has a right to interfere with this.  It's akin to telling a cancer patient they can't have medical care that may put their cancer in remission or save their life. The government has no right to come between a patient and their doctor in determining what medical treatment is best for the patient.\n\nThe link below is an excellent video that compares sex education in the United States and the Netherlands.",0,0,0
"182","Hall, Seth","Seth Hall KY",0,"“Be the Shining City on the Hill”  \nGuarantee equal treatment for women and people of color in the workplace -- pay, hiring, promotions, etc.\nPromote programs that provide opportunities for women, people of color, and millennials.\nWork to get money out of politics by overturning the “Citizens United” ruling.\nPrevent discrimination against LGTBQ Americans.\nAddress domestic abuse and sexual assault with strong preventative measures, including age-appropriate anti-violence education.",0,0,0
"183","Lord, Christina","Christina Lord KY",1,NA,0,0,0
"184","Piatt, Patti","Patti Piatt KY",1,"Here are some facts; abortion rates are coming down, they are the lowest in 45 years for one reason. The Affordable Care Act, including lower costs of birth control for young women, better access to reproductive health services are reducing abortion. Nobody likes abortion, but the two sides differ greatly on how to reduce the number of abortions. I made the choice to have a child as a single mother. It was extremely difficult. But it was my decision. I would never want the government or anyone to interfere with a woman’s right to make her own medical decisions.",0,0,0
"185","Sykes, Scott","Scott Sykes KY",0,"Respect the reproductive rights of women and ensure that women in Eastern Kentucky have access to family planning",0,0,0
"186","Young, Geoff","Geoffrey Young KY",0,"Barr is objectively (& unknowingly) pro-abortion.  Geoff is objectively pro-life because his (and Planned Parenthood's) policies would lower the abortion rate. (4 minutes)",0,0,2
"187","Gray, Jim","Jim Gray KY",0,"Jim also believes women should continue to be in control of their healthcare decisions.

Jim stands up for equality, believing that all men and women were created equal and they should be treated that way, with opportunity and dignity for everyone.\nAs mayor, he led by example. Not only is he openly gay, as mayor he also ensured that his administration included a diverse group of people proportional to the demographic make-up of Lexington, including more than half of the mayor’s administration’s appointees are women. Jim also appointed the city’s first black fire chief in 2011, the first female fire chief in 2016 and the city’s second black chief of police this year.",0,0,2
"188","Thomas, Reggie","Reggie Thomas KY",0,NA,0,0,2
"189","McGrath, Amy","Amy McGrath KY",1,"Let’s talk about sexual harassment. It's such an important, and long overdue conversation for us to have as a nation.\nFirst, we cannot let it become a partisan issue. Otherwise, it will become a political football and never be dealt with by our society, and we lose a crucial opportunity for meaningful reckoning, healing, and education. This affliction doesn’t fall along partisan lines — Roy Moore, John Conyers, Harvey Weinstein, Charlie Rose, Al Franken, Donald Trump, and the list goes on.\nAll inappropriate physical harassment perpetrated by those in power upon women (or men) is wrong and cannot be tolerated, and predatory behavior towards children/teenagers, as is alleged in Alabama regarding Roy Moore, should be treated for what it is — outright child molestation.\nThis cultural shift may well represent a watershed moment. It is likely that more women will speak out against prominent political and establishment figures, and they should. We've come to learn that predatory behavior doesn’t typically happen just once. When the first courageous person decides to speak out, we have to expect that more will follow and what we have been ignoring in our workplaces and professions for some time will begin to surface. We have to resist the natural impulse to give the benefit of the doubt for those we tend to like, but not those on the other side. Bad behavior by Democrats should not be viewed as less detrimental to us than by those we disagree with politically.\nWe had (and continue to have) this problem in our military. I lived through times in my career where the culture was such that speaking out was certainly not in the best interest of one's career. Be silent, look the other way, don't cause waves, brush it off...these were all coping mechanisms for many women in the military. But the military has made strides in this area and I could see a real positive difference during my 24-year career.\nIn my experience, the very best way to combat this type of behavior is for leaders to foster an environment of respect for all, and one where anyone can feel like he/she can come forward (without repercussion) should there be sexual harassment or assault. That means leaders must make known their expectations that the behavior will never be tolerated nor covered up, and of course follow through with it (even when the perpetrator is someone high ranking or well known to the leader).\nAlso, it was only when women began to rise in the officer and enlisted ranks that the systemic harassment and hazing began to subside in the units that had women. When the military ranks were largely an all-boys club, this behavior went largely unchecked. It was the promotion of more senior women officers and senior enlisted that made a difference. That's an incredibly important lesson. When we see more women in places like corporate board rooms and elected to office, it will be harder to get away with abusive behavior.\nFinally, we have to look out for each other, regardless of gender. Each of us (men and women) can make a real difference when we stand up, say something, and refuse to look the other way. Often, it takes only one person to intervene. When the perpetrator is the person in power, we have to foster a society where people can come forward and hold their leaders publicly accountable too.",0,0,2
"190","St. Clair, Lucas","Lucas St. Clair ME",0,"Our country is at a powerful turning point, where the stories of women who have faced sexual abuse and harassment are finally starting to be heard. We have the obligation to listen – and believe – people who have suffered abuse, and make systematic change to hold abusers accountable and to change a culture that has allowed abuse to go unpunished. \nDetails: \nThe first step in ending the culture of sexual harassment, domestic violence, and gender inequality is to say something when we see something and to end the conspiracy of silence that has empowered and protected abusers. But there are also commonsense policy solutions that need to be enacted immediately, including:\n1. Eliminate the slush fund used by members of Congress to silence victims of sexual harassment. \n2. Immediately reauthorize the Violence Against Women Act\n3. Pass the Paycheck Fairness Act to close loopholes that allow employers to pay women less than men for the same jobs\n4. Raise the minimum wage and enact paid sick and family leave policies. Economic security for women is a key component of ending domestic violence\n5. Support legislation that would require government agencies and contractors to disclose the number of sexual harassment complaints they receive annually\n6. Support Planned Parenthood and guarantee the right of every woman to make her own health care decisions in consultation with her doctor and family, regardless of economic circumstance",0,0,2
"191","Olson, Craig","Craig Olson ME",0,NA,0,0,2
"192","Golden, Jared","Jared Golden ME",0,"Congress must do more to end gender-based wage discrimination. In 2017, working women in Maine were paid approximately $10,000 less than working men – amounting to nearly $3 billion in lost wages every year.\nIn Maine, women lead more than 53,000 family households, of which 28 percent earn incomes that fall below the poverty line. By ending wage discrimination, we would not only lift Maine families out of poverty, but working women in our state would have more money for healthcare, childcare, rent and mortgage payments, college tuition and retirement.\nAdditionally, the United States is the only developed nation in the world without mandatory paid family leave. As an employer, I believe paid family leave polices benefit my campaign staff. In Congress, I will fight to expand these policies for all Americans, because people deserve time off to care for newborn children or sick loved ones. These policies will not only benefit Maine’s children and families, but also our economy.\nFinally, I believe every woman has the right to make her own healthcare decisions. Family planning options, including contraception, should be accessible and affordable to all women, regardless of income or insurance. I also firmly believe that Washington politicians have no business being involved in the private medical choices made between a woman and her healthcare professional.",0,0,2
"193","Colvin, Jesse","Jesse Colvin MD",0,"The Framers almost had it right: all people are created equal. Representatives and senators earn the same salary, no matter their gender. A female president would earn the same salary as a male one. So why are women too often paid less than the men working beside them doing the same job?\n \nI am not satisfied with the status quo, and I don’t think most people are. As a country, we can only make progress if we stand together. We can only stand together if we are all on equal footing. America is at its best when our laws protect everyone equally and ensure everyone has equal opportunity. From equal pay to healthcare and beyond, I will be your strongest advocate. Not just for you. But for all of us.",0,0,0
"194","Pullen, Michael","Michael Pullen MD",0,"Our society is one that indefensibly creates double standards for men and women. Women are objectified, harassed, and face gender-based violence on a daily basis. Make no mistake, this is a societal problem that must be addressed head-on at a national level. The Federal government has a duty to ensure that all citizens, regardless of gender, are treated equally.\nOur society is one that indefensibly creates double standards for men and women. Women are objectified, harassed, and face gender-based violence on a daily basis. Make no mistake, this is a societal problem that must be addressed head-on at a national level. The Federal government has a duty to ensure that all citizens, regardless of gender, are treated equally.Yet under the current administration, the rights of women to self-autonomy have faced unprecedented attack. From Congress’s proposed ban on funding for Planned Parenthood, to State legislatures attempting to unconstitutionally roll back pro-choice protections, Republican ideology is clearly getting in the way of protecting women’s health and furthering gender equality. Standing with WomenNearly every day, it seems there are new developments regarding sexual harassment, assault and domestic violence by the likes of Harvey Weinstein, Roy Moore, and Donald Trump. I've dealt with bullies like them before. I've taken them on and won. Standing up, taking responsibility, showing empathy for others, and speaking truth to power are part of who I am.In 1982, I was working in Talbot County as a 31-year old trial lawyer when I learned that my boss, the senior partner, was sexually abusing firm clients. When confronted he flatly denied it. The firm fired him, made me a partner and contacted the victims to report the abuse.The victims chose to not report it. They wanted their privacy – no lawsuits, no news stories, no spotlight. Their decision was personal and confidential and protected under attorney-client privilege. The abuser sued the firm and all its members, including me. He pretended the abuse had never occurred, concocted bogus claims about why he was fired and sued each of us for over $1 million dollars.We continued to honor the autonomy of the victims and protect their privacy by not dragging them into that lawsuit. That was the right thing to do. In 1992, several victims reported the abuser.  He continued to deny it and I testified against him in court. The court used my testimony to verify the abuse and disciplined him in 1993. As a result, he never practiced law again. Three months later the Talbot County Council appointed me to become the first full-time Talbot County Attorney. I held that Office for 24 years, working with both Democratic and Republican members of the County Council to serve the people of Talbot County.I stood with the victims when they chose their privacy because that was right. I stood with them when they came forward because that was right. When we do right – we win. Standing up, taking responsibility, showing empathy for others, and speaking truth to power are part of who I am.  It’s what I’ve done throughout my career. I will continue to fight for those who struggle to make ends meet, for good jobs, for healthcare for all Americans, for our environment, for the sick and the elderly. When we stand together and fight for what’s right – we win. That’s what I’ll do for the people of the 1st District of Maryland in Congress.Social Media",0,0,0
"195","Galbraith, Allison","Allison Galbraith MD",1,NA,0,0,0
"196","Lane, Erik","Erik Lane MD",0,NA,0,0,0
"197","Worton, Steve","Steve Worton MD",0,NA,0,0,0
"198","Pretot, Jake","Jake Pretot MD",0,NA,0,0,1
"199","DeMarco, Adam","Adam DeMarco MD",0,NA,0,0,1
"200","Fritz, Dennis","Dennis Fritz MD",0,NA,0,0,1
"201","Hashimi, Nadia","Nadia Hashimi MD",1,"We have gotten as far as we have on gender equality only because brave women paved the way. We can’t let the momentum falter. We need equality and parity, without disclaimers. Pregnancy or domestic violence should never be classified as pre-existing conditions and exclude women from health coverage. Lets not mistake being pro-choice with being anti-life. Groups like Planned Parenthood can help with family planning, education, health screenings and preventative care, particularly where there are barriers to access.\n\n\nAs your Congresswoman I will fight for:\nEqual pay for equal work\nExpeditious processing of sexual assault cases\nA woman’s right to make decisions for her body\nKeeping guns out of the hands of those with a history of intimate partner violence (IPV)\nAccess to reproductive health resources including contraception, maternity and newborn care\nProtecting Planned Parenthood\nUniform laws to ban child marriage in the United States\nChildcare programs at community colleges",0,1,2
"202","Graves, Chris","Chris Graves MD",0,"I trust women.  I believe politicians should never come between a woman and her doctor when it comes to reproductive health — from contraception to abortion. The right to decide when and how to start a family (or not) is fundamental to women’s economic and societal autonomy. The constant chipping away at the fundamental promise of Roe has made it nothing more than an illusion for too many women — especially low-income women, women of color, immigrant women and LGBTQ women.\nAs your Congressman, I will:\nSign on to the EACH Woman Act and will support the repeal of the Hyde Amendment and any other law, rule, or executive order designed to eliminate federal funding of abortion care for women who rely on the federal government for their health care. \nStand with Planned Parenthood and will fight any attempt by anti-choice politicians to eliminate federal funding for Planned Parenthood and critical services it provides.\nFight to ensure that the government has no role in denying women access to contraception, abortion care or any other reproductive health care through their employer-provide insurance plans or state insurance exchange plans.

It is shameful that in 2018 all women — and notably women of color — are still paid less than men, face employment discrimination based on their gender (and race), and are disproportionately victims of violence perpetrated by men. \nIn Congress, I will:\nChampion women’s and girls’ empowerment in all its forms.\nVote to fund STEM programs to advance women and girls in math and science education and careers.\nProvide federally mandated paid sick leave and paid maternity and parental leave\nSupport Rep. Jackie Spears’ ME TOO Act that, if passed, will hold Congressional lawmakers accountable and make the process of reporting sexual harassment more transparent and supportive for the victim. \nCall for mandatory anti-sexual harassment training for Members of Congress, staff and interns.",0,1,2
"203","Hearsey, Christopher","Chris Hearsey MD",0,NA,0,1,2
